<?xml version="1.0"?>
<model xmlns="http://Cyden" xmlns:xsi="http://www.w3.org/2001/XMLSchema-instance" xsi:schemaLocation="http://Cyden func_xml.xsd">
  <rules>
    <rule>
      <fact fact="spring"></fact>
      <resultingFact fact="rain111111"></resultingFact>
    </rule>
    <rule>
      <and>
        <fact fact="spring"/>
        <fact fact="winter"/>
      </and>
      <resultingFact fact="autumn"/>
    </rule>
    <rule>
      <or>
        <fact fact="spring1" />
        <fact fact="winter" />
        <and>
          <fact fact="summer"/>
          <fact fact="rain" />
        </and>
      </or>
      <resultingFact fact="autumn"/>
    </rule>
  </rules>
  <approvedFacts>
    <approvedFact>spring</approvedFact>
    <approvedFact>summer</approvedFact>
  </approvedFacts>
</model>
